[
  {
    "start": 0.0,
    "end": 0.1,
    "lang": "hi",
    "text": "mock",
    "translation": "mock",
    "source": "stt",
    "first_shown_at": 2.48,
    "revisions": [
      {
        "at": 2.48,
        "text": "mock"
      }
    ]
  },
  {
    "start": 1.0,
    "end": 1.1,
    "lang": "hi",
    "text": "mock",
    "translation": "mock",
    "source": "stt",
    "first_shown_at": 3.49,
    "revisions": [
      {
        "at": 3.49,
        "text": "mock"
      }
    ]
  },
  {
    "start": 2.0,
    "end": 2.1,
    "lang": "hi",
    "text": "mock",
    "translation": "mock",
    "source": "stt",
    "first_shown_at": 4.5,
    "revisions": [
      {
        "at": 4.5,
        "text": "mock"
      }
    ]
  }
]
